{
  "schema_version": "roadmap_index.v1",
  "created_at": "2026-01-02T00:00:00Z",
  "updated_at": "2026-01-02T22:00:00Z",
  "work_orders": [
    {
      "id": "reqs-mvp-matrix",
      "title": "Define MVP compatibility matrix and acceptance tests for WinCairo limitations",
      "status": "completed",
      "depends_on": [],
      "work_order_path": ".ai/work_orders/reqs-mvp-matrix.json"
    },
    {
      "id": "webkit-fork-ci",
      "title": "Create and wire up a maintained WebKit fork for Windows builds + LayoutTests/WPT subset",
      "status": "completed",
      "depends_on": ["reqs-mvp-matrix"],
      "work_order_path": ".ai/work_orders/webkit-fork-ci.json"
    },
    {
      "id": "hiwave-embedder-harness",
      "title": "Build standalone HiWave-like harness to reproduce resize and multi-view issues",
      "status": "completed",
      "depends_on": ["reqs-mvp-matrix"],
      "work_order_path": ".ai/work_orders/hiwave-embedder-harness.json"
    },
    {
      "id": "rustkit-viewhost",
      "title": "Implement Win32 ViewHost layer (child HWND creation, WM_SIZE/DPI handling, focus, visibility)",
      "status": "completed",
      "depends_on": ["reqs-mvp-matrix", "hiwave-embedder-harness"],
      "work_order_path": ".ai/work_orders/rustkit-viewhost.json"
    },
    {
      "id": "rustkit-compositor",
      "title": "Implement GPU compositor with per-view swapchain/DirectComposition visual",
      "status": "completed",
      "depends_on": ["rustkit-viewhost"],
      "work_order_path": ".ai/work_orders/rustkit-compositor.json"
    },
    {
      "id": "engine-scheduler-core",
      "title": "Implement engine core runtime (task queues, timers, navigation state machine)",
      "status": "completed",
      "depends_on": ["rustkit-viewhost"],
      "work_order_path": ".ai/work_orders/engine-scheduler-core.json"
    },
    {
      "id": "html-dom-pipeline",
      "title": "Implement HTML parsing + DOM tree + basic render tree construction",
      "status": "completed",
      "depends_on": ["engine-scheduler-core"],
      "work_order_path": ".ai/work_orders/html-dom-pipeline.json"
    },
    {
      "id": "css-style-system",
      "title": "Implement CSS parsing + cascade/inheritance and connect to layout",
      "status": "completed",
      "depends_on": ["html-dom-pipeline"],
      "work_order_path": ".ai/work_orders/css-style-system.json"
    },
    {
      "id": "layout-block-inline",
      "title": "Implement block + inline layout, text shaping, and painting for basic pages",
      "status": "completed",
      "depends_on": ["css-style-system"],
      "work_order_path": ".ai/work_orders/layout-block-inline.json"
    },
    {
      "id": "js-engine-integration",
      "title": "Integrate JavaScript engine (Boa/V8) with RustKit",
      "status": "completed",
      "depends_on": ["html-dom-pipeline"],
      "work_order_path": ".ai/work_orders/js-engine-integration.json"
    },
    {
      "id": "dom-bindings",
      "title": "Create JavaScript-to-DOM bindings for web API compatibility",
      "status": "completed",
      "depends_on": ["js-engine-integration", "html-dom-pipeline"],
      "work_order_path": ".ai/work_orders/dom-bindings.json"
    },
    {
      "id": "networking-http",
      "title": "Implement HTTP networking layer with async fetch support",
      "status": "completed",
      "depends_on": ["engine-scheduler-core"],
      "work_order_path": ".ai/work_orders/networking-http.json"
    },
    {
      "id": "request-interception",
      "title": "Implement request interception for URL filtering and modification",
      "status": "completed",
      "depends_on": ["networking-http"],
      "work_order_path": ".ai/work_orders/request-interception.json"
    },
    {
      "id": "download-manager",
      "title": "Implement download manager with progress tracking and cancellation",
      "status": "completed",
      "depends_on": ["networking-http"],
      "work_order_path": ".ai/work_orders/download-manager.json"
    },
    {
      "id": "multiview-integration",
      "title": "Create multi-view orchestration layer that integrates all RustKit crates",
      "status": "completed",
      "depends_on": ["rustkit-viewhost", "rustkit-compositor", "html-dom-pipeline", "js-engine-integration", "networking-http"],
      "work_order_path": ".ai/work_orders/multiview-integration.json"
    },
    {
      "id": "observability-hardening",
      "title": "Add comprehensive error handling, logging, and resilience",
      "status": "completed",
      "depends_on": ["multiview-integration"],
      "work_order_path": ".ai/work_orders/observability-hardening.json"
    },
    {
      "id": "hiwave-integration",
      "title": "Integrate RustKit engine into HiWave as alternative backend",
      "status": "completed",
      "depends_on": ["multiview-integration", "observability-hardening"],
      "work_order_path": ".ai/work_orders/hiwave-integration.json"
    },
    {
      "id": "wpt-harness",
      "title": "WPT-style test harness for RustKit conformance testing",
      "status": "completed",
      "depends_on": ["hiwave-integration"],
      "work_order_path": ".ai/work_orders/wpt-harness.json"
    },
    {
      "id": "perf-benchmarks",
      "title": "Performance benchmarking infrastructure for RustKit",
      "status": "completed",
      "depends_on": ["wpt-harness"],
      "work_order_path": ".ai/work_orders/perf-benchmarks.json"
    },
    {
      "id": "wincairo-removal",
      "title": "Remove WinCairo WebKit and transition to RustKit",
      "status": "completed",
      "depends_on": ["perf-benchmarks", "hiwave-integration"],
      "work_order_path": ".ai/work_orders/wincairo-removal.json"
    },
    {
      "id": "css-box-model",
      "title": "Phase 12: CSS Box Model & Visual Formatting",
      "status": "completed",
      "depends_on": ["wincairo-removal"],
      "work_order_path": ".ai/work_orders/css-box-model.json"
    },
    {
      "id": "text-rendering",
      "title": "Phase 13: Text Rendering & Fonts",
      "status": "completed",
      "depends_on": ["css-box-model"],
      "work_order_path": ".ai/work_orders/text-rendering.json"
    },
    {
      "id": "event-handling",
      "title": "Phase 14: Event Handling",
      "status": "pending",
      "depends_on": ["css-box-model"],
      "work_order_path": ".ai/work_orders/event-handling.json"
    },
    {
      "id": "forms-input",
      "title": "Phase 15: Forms & Input",
      "status": "pending",
      "depends_on": ["event-handling", "text-rendering"],
      "work_order_path": ".ai/work_orders/forms-input.json"
    },
    {
      "id": "images-media",
      "title": "Phase 16: Images & Media",
      "status": "pending",
      "depends_on": ["css-box-model"],
      "work_order_path": ".ai/work_orders/images-media.json"
    },
    {
      "id": "css-flexbox",
      "title": "Phase 17: CSS Flexbox",
      "status": "pending",
      "depends_on": ["css-box-model"],
      "work_order_path": ".ai/work_orders/css-flexbox.json"
    },
    {
      "id": "scrolling-overflow",
      "title": "Phase 18: Scrolling & Overflow",
      "status": "pending",
      "depends_on": ["css-box-model", "event-handling"],
      "work_order_path": ".ai/work_orders/scrolling-overflow.json"
    },
    {
      "id": "navigation-history",
      "title": "Phase 19: Navigation & History",
      "status": "pending",
      "depends_on": ["event-handling"],
      "work_order_path": ".ai/work_orders/navigation-history.json"
    },
    {
      "id": "security-isolation",
      "title": "Phase 20: Security & Isolation",
      "status": "pending",
      "depends_on": ["networking-http", "dom-bindings"],
      "work_order_path": ".ai/work_orders/security-isolation.json"
    }
  ]
}
